{
  "$schema": "http://json-schema.org/draft-07/schema#",
  "$id": "https://tangleai.dev/schemas/locomo-recall",
  "title": "LoCoMo evidence-recall report — order 02's document",
  "description": "What `benchmark/locomo-recall.ts` writes, validated before it is written. Orders 15, 16 and 03 EXTEND this document (a `parity`, an `answers`, a `temporal` block beside these); they do not fork it. No timing and no clock reading is allowed in here: the same dataset and config must produce byte-identical bytes.",
  "type": "object",
  "required": ["benchmark", "instrument", "dataset", "config", "corpus", "questions", "ceiling", "floor", "rows", "gate"],
  "additionalProperties": false,
  "properties": {
    "benchmark": { "const": "locomo" },
    "instrument": { "const": "locomo-recall" },
    "dataset": {
      "type": "object",
      "required": ["path", "sha256", "bytes", "schemaValid", "conversations", "restricted"],
      "additionalProperties": false,
      "properties": {
        "path": { "type": "string", "minLength": 1 },
        "sha256": { "type": "string", "pattern": "^[0-9a-f]{64}$" },
        "bytes": { "type": "integer", "minimum": 1 },
        "schemaValid": { "type": "boolean" },
        "conversations": { "type": "integer", "minimum": 0 },
        "restricted": { "oneOf": [{ "type": "null" }, { "type": "array", "items": { "type": "string", "minLength": 1 } }] }
      }
    },
    "config": {
      "type": "object",
      "required": ["embedder", "ks", "seed", "ingest", "clock", "maxPairs", "thresholds"],
      "additionalProperties": false,
      "properties": {
        "embedder": {
          "type": "object",
          "required": ["model", "dims"],
          "additionalProperties": false,
          "properties": { "model": { "type": "string", "minLength": 1 }, "dims": { "type": "integer", "minimum": 1 } }
        },
        "ks": { "type": "array", "minItems": 1, "items": { "type": "integer", "minimum": 1 } },
        "seed": { "type": "integer" },
        "ingest": { "const": "per-session" },
        "clock": { "type": "string", "minLength": 1 },
        "maxPairs": { "type": "integer", "minimum": 0 },
        "thresholds": { "$ref": "#/definitions/thresholds" }
      }
    },
    "corpus": {
      "type": "object",
      "required": ["conversations", "sessions", "refusedSessions", "turns", "imageTurns", "collapsed", "span"],
      "additionalProperties": false,
      "properties": {
        "conversations": { "type": "integer", "minimum": 0 },
        "sessions": { "type": "integer", "minimum": 0 },
        "refusedSessions": { "type": "integer", "minimum": 0 },
        "turns": { "type": "integer", "minimum": 0 },
        "imageTurns": { "type": "integer", "minimum": 0 },
        "collapsed": { "type": "integer", "minimum": 0 },
        "span": {
          "oneOf": [
            { "type": "null" },
            {
              "type": "object",
              "required": ["start", "end"],
              "additionalProperties": false,
              "properties": { "start": { "$ref": "#/definitions/instant" }, "end": { "$ref": "#/definitions/instant" } }
            }
          ]
        }
      }
    },
    "questions": {
      "type": "object",
      "required": ["total", "scorable", "byCategory", "noEvidence", "excluded"],
      "additionalProperties": false,
      "properties": {
        "total": { "type": "integer", "minimum": 0 },
        "scorable": { "type": "integer", "minimum": 0 },
        "byCategory": {
          "type": "object",
          "required": ["1", "2", "3", "4", "5"],
          "additionalProperties": false,
          "properties": {
            "1": { "type": "integer", "minimum": 0 },
            "2": { "type": "integer", "minimum": 0 },
            "3": { "type": "integer", "minimum": 0 },
            "4": { "type": "integer", "minimum": 0 },
            "5": { "type": "integer", "minimum": 0 }
          }
        },
        "noEvidence": { "type": "integer", "minimum": 0 },
        "excluded": {
          "type": "object",
          "required": ["category", "count", "reason"],
          "additionalProperties": false,
          "properties": {
            "category": { "const": 5 },
            "count": { "type": "integer", "minimum": 0 },
            "reason": { "type": "string", "minLength": 1 }
          }
        }
      }
    },
    "ceiling": { "$ref": "#/definitions/recallByK" },
    "floor": {
      "type": "object",
      "additionalProperties": false,
      "patternProperties": {
        "^[0-9]+$": {
          "type": "object",
          "required": ["floor", "low", "high"],
          "additionalProperties": false,
          "properties": {
            "floor": { "$ref": "#/definitions/unit" },
            "low": { "$ref": "#/definitions/unit" },
            "high": { "$ref": "#/definitions/unit" }
          }
        }
      }
    },
    "rows": { "type": "array", "minItems": 2, "items": { "$ref": "#/definitions/row" } },
    "gate": {
      "type": "object",
      "required": ["passed", "failures"],
      "additionalProperties": false,
      "properties": {
        "passed": { "type": "boolean" },
        "failures": { "type": "array", "items": { "type": "string", "minLength": 1 } }
      }
    }
  },
  "definitions": {
    "unit": { "type": "number", "minimum": 0, "maximum": 1 },
    "unitOrAbsent": {
      "description": "A restricted run may hold no question of a category; that is an absent measurement, never 0.",
      "oneOf": [{ "type": "null" }, { "$ref": "#/definitions/unit" }]
    },
    "instant": { "type": "string", "pattern": "^\\d{4}-\\d{2}-\\d{2}T\\d{2}:\\d{2}:\\d{2}(\\.\\d+)?Z$" },
    "thresholds": {
      "type": "object",
      "required": ["novelty", "contradiction", "crystallize"],
      "additionalProperties": false,
      "properties": {
        "novelty": { "type": "number", "minimum": 0 },
        "contradiction": { "type": "number", "minimum": 0 },
        "crystallize": { "type": "number", "minimum": 0 }
      }
    },
    "recallAtK": {
      "type": "object",
      "required": ["overall", "byCategory"],
      "additionalProperties": false,
      "properties": {
        "overall": { "$ref": "#/definitions/unit" },
        "byCategory": {
          "type": "object",
          "required": ["1", "2", "3", "4"],
          "additionalProperties": false,
          "properties": {
            "1": { "$ref": "#/definitions/unitOrAbsent" },
            "2": { "$ref": "#/definitions/unitOrAbsent" },
            "3": { "$ref": "#/definitions/unitOrAbsent" },
            "4": { "$ref": "#/definitions/unitOrAbsent" }
          }
        }
      }
    },
    "recallByK": {
      "type": "object",
      "minProperties": 1,
      "additionalProperties": false,
      "patternProperties": { "^[0-9]+$": { "$ref": "#/definitions/recallAtK" } }
    },
    "ingest": {
      "type": "object",
      "required": ["runs", "observations", "embedded", "admitted", "filtered", "judged", "contradictions", "resolutions", "merged", "live", "total", "superseded"],
      "additionalProperties": false,
      "properties": {
        "runs": { "type": "integer", "minimum": 0 },
        "observations": { "type": "integer", "minimum": 0 },
        "embedded": { "type": "integer", "minimum": 0 },
        "admitted": { "type": "integer", "minimum": 0 },
        "filtered": { "type": "integer", "minimum": 0 },
        "judged": { "type": "integer", "minimum": 0 },
        "contradictions": { "type": "integer", "minimum": 0 },
        "resolutions": { "type": "integer", "minimum": 0 },
        "merged": { "type": "integer", "minimum": 0 },
        "live": { "type": "integer", "minimum": 0 },
        "total": { "type": "integer", "minimum": 0 },
        "superseded": { "type": "integer", "minimum": 0 }
      }
    },
    "row": {
      "type": "object",
      "required": ["key", "label", "kind", "recall"],
      "additionalProperties": false,
      "properties": {
        "key": { "type": "string", "minLength": 1 },
        "label": { "type": "string", "minLength": 1 },
        "kind": { "enum": ["gate", "baseline", "pipeline"] },
        "thresholds": { "$ref": "#/definitions/thresholds" },
        "ingest": { "$ref": "#/definitions/ingest" },
        "retrieval": {
          "type": "object",
          "required": ["unranked", "creditedViaMerge"],
          "additionalProperties": false,
          "properties": {
            "unranked": { "type": "integer", "minimum": 0 },
            "creditedViaMerge": {
              "type": "object",
              "additionalProperties": false,
              "patternProperties": { "^[0-9]+$": { "type": "integer", "minimum": 0 } }
            }
          }
        },
        "recall": { "$ref": "#/definitions/recallByK" }
      },
      "if": { "properties": { "kind": { "const": "pipeline" } } },
      "then": { "required": ["thresholds", "ingest", "retrieval"] }
    }
  }
}
