{
  "benchmark": "locomo",
  "instrument": "locomo-recall",
  "dataset": {
    "path": "benchmark/locomo/data/locomo10.json",
    "sha256": "79fa87e90f04081343b8c8debecb80a9a6842b76a7aa537dc9fdf651ea698ff4",
    "bytes": 2805274,
    "schemaValid": true,
    "conversations": 10,
    "restricted": null
  },
  "config": {
    "embedder": {
      "model": "hash-trigram-64",
      "dims": 64
    },
    "ks": [
      5,
      10,
      20
    ],
    "seed": 17753,
    "ingest": "per-session",
    "clock": "the last session instant of each conversation",
    "maxPairs": 20,
    "thresholds": {
      "novelty": 0.97,
      "contradiction": 0.8,
      "crystallize": 0.9
    }
  },
  "corpus": {
    "conversations": 10,
    "sessions": 272,
    "refusedSessions": 0,
    "turns": 5882,
    "imageTurns": 910,
    "collapsed": 5,
    "span": {
      "start": "2022-01-21T19:31:00.000Z",
      "end": "2024-01-12T13:41:00.000Z"
    }
  },
  "questions": {
    "total": 1986,
    "scorable": 1540,
    "byCategory": {
      "1": 282,
      "2": 321,
      "3": 96,
      "4": 841,
      "5": 446
    },
    "noEvidence": 4,
    "excluded": {
      "category": 5,
      "count": 446,
      "reason": "adversarial questions carry no `answer` (444 of 446) and the official evaluator scores the category by keyword, which marks the factually correct answer wrong"
    }
  },
  "ceiling": {
    "5": {
      "overall": 0.9910135135683967,
      "byCategory": {
        "1": 0.9725017061243265,
        "2": 0.9968847352024922,
        "3": 0.950506907308378,
        "4": 0.9996036464526357
      }
    },
    "10": {
      "overall": 0.9954417869801248,
      "byCategory": {
        "1": 0.9922565924805565,
        "2": 0.9968847352024922,
        "3": 0.9635138146167558,
        "4": 0.9996036464526357
      }
    },
    "20": {
      "overall": 0.996134817563389,
      "byCategory": {
        "1": 0.9942586963863561,
        "2": 0.9968847352024922,
        "3": 0.96875,
        "4": 0.9996036464526357
      }
    }
  },
  "floor": {
    "5": {
      "floor": 0.011152423201393816,
      "low": 0.0019018898811807555,
      "high": 0.020402956521606876
    },
    "10": {
      "floor": 0.019707443805384972,
      "low": 0.0069497102052627924,
      "high": 0.032465177405507153
    },
    "20": {
      "floor": 0.036817485013367166,
      "low": 0.01920243722552908,
      "high": 0.05443253280120525
    }
  },
  "rows": [
    {
      "key": "oracle",
      "label": "oracle (gold first)",
      "kind": "gate",
      "recall": {
        "5": {
          "overall": 0.9910135135683967,
          "byCategory": {
            "1": 0.9725017061243265,
            "2": 0.9968847352024922,
            "3": 0.950506907308378,
            "4": 0.9996036464526357
          }
        },
        "10": {
          "overall": 0.9954417869801248,
          "byCategory": {
            "1": 0.9922565924805565,
            "2": 0.9968847352024922,
            "3": 0.9635138146167558,
            "4": 0.9996036464526357
          }
        },
        "20": {
          "overall": 0.996134817563389,
          "byCategory": {
            "1": 0.9942586963863561,
            "2": 0.9968847352024922,
            "3": 0.96875,
            "4": 0.9996036464526357
          }
        }
      }
    },
    {
      "key": "random",
      "label": "random (seed 17753)",
      "kind": "gate",
      "recall": {
        "5": {
          "overall": 0.0071969696969696965,
          "byCategory": {
            "1": 0.004432624113475178,
            "2": 0.00778816199376947,
            "3": 0.05034722222222223,
            "4": 0.002972651605231867
          }
        },
        "10": {
          "overall": 0.014362563207101022,
          "byCategory": {
            "1": 0.009667342114150625,
            "2": 0.010903426791277258,
            "3": 0.050959967320261444,
            "4": 0.013079667063020214
          }
        },
        "20": {
          "overall": 0.03136423577695541,
          "byCategory": {
            "1": 0.028609422492401216,
            "2": 0.024402907580477674,
            "3": 0.07187221479500891,
            "4": 0.03032104637336504
          }
        }
      }
    },
    {
      "key": "recency",
      "label": "recency (last k turns)",
      "kind": "baseline",
      "recall": {
        "5": {
          "overall": 0.004383116883116883,
          "byCategory": {
            "1": 0.0017730496453900709,
            "2": 0,
            "3": 0.044270833333333336,
            "4": 0.0023781212841854932
          }
        },
        "10": {
          "overall": 0.0125,
          "byCategory": {
            "1": 0.0035460992907801418,
            "2": 0.009345794392523364,
            "3": 0.0546875,
            "4": 0.011890606420927468
          }
        },
        "20": {
          "overall": 0.026745841877420823,
          "byCategory": {
            "1": 0.011011571481896229,
            "2": 0.03374870197300103,
            "3": 0.07552083333333333,
            "4": 0.023781212841854936
          }
        }
      }
    },
    {
      "key": "near-raw",
      "label": "near (policies off)",
      "kind": "pipeline",
      "thresholds": {
        "novelty": 2,
        "contradiction": 2,
        "crystallize": 2
      },
      "ingest": {
        "runs": 272,
        "observations": 5882,
        "embedded": 5882,
        "admitted": 5882,
        "filtered": 0,
        "judged": 0,
        "contradictions": 0,
        "resolutions": 0,
        "merged": 0,
        "live": 5877,
        "total": 5877,
        "superseded": 0
      },
      "retrieval": {
        "unranked": 0,
        "creditedViaMerge": {
          "5": 0,
          "10": 0,
          "20": 0
        }
      },
      "recall": {
        "5": {
          "overall": 0.12420546317700636,
          "byCategory": {
            "1": 0.041638650947161585,
            "2": 0.13914849428868123,
            "3": 0.07153799019607843,
            "4": 0.15219976218787157
          }
        },
        "10": {
          "overall": 0.17407014748773222,
          "byCategory": {
            "1": 0.07260599246881441,
            "2": 0.20768431983385255,
            "3": 0.07215073529411765,
            "4": 0.20689655172413793
          }
        },
        "20": {
          "overall": 0.25049659134351143,
          "byCategory": {
            "1": 0.12605103048832048,
            "2": 0.3115264797507788,
            "3": 0.09081625074272133,
            "4": 0.28715814506539833
          }
        }
      }
    },
    {
      "key": "near",
      "label": "near (pipeline defaults)",
      "kind": "pipeline",
      "thresholds": {
        "novelty": 0.97,
        "contradiction": 0.8,
        "crystallize": 0.9
      },
      "ingest": {
        "runs": 272,
        "observations": 5882,
        "embedded": 5882,
        "admitted": 5876,
        "filtered": 6,
        "judged": 5326,
        "contradictions": 63,
        "resolutions": 0,
        "merged": 339,
        "live": 5485,
        "total": 5537,
        "superseded": 52
      },
      "retrieval": {
        "unranked": 0,
        "creditedViaMerge": {
          "5": 10,
          "10": 17,
          "20": 38
        }
      },
      "recall": {
        "5": {
          "overall": 0.11460048482202799,
          "byCategory": {
            "1": 0.040604371987350715,
            "2": 0.12980269989615784,
            "3": 0.07153799019607843,
            "4": 0.13852556480380498
          }
        },
        "10": {
          "overall": 0.16526663434693872,
          "byCategory": {
            "1": 0.0716027994443448,
            "2": 0.18380062305295952,
            "3": 0.07623570261437909,
            "4": 0.19976218787158145
          }
        },
        "20": {
          "overall": 0.24138403723095733,
          "byCategory": {
            "1": 0.12829689337248124,
            "2": 0.29750778816199375,
            "3": 0.1151218062982769,
            "4": 0.272294887039239
          }
        }
      }
    }
  ],
  "gate": {
    "passed": true,
    "failures": []
  }
}
